text,disaster_type,severity,locations,url,published_at
isnt internet back yet hidden challenge network restoration expert awardwinning staff selects product cover rigorously research test top pick buy link may get commission test isps even wireless internet provider contend outage storm here internet provider race get back online internet power outage often linger big storm pas sometimes internet network take much longer repair usual home business experienced power outage hurricane helene swept rural mountain community sept hurricane one western carolina could expected onein year storm worsened previous rainfall rugged mountainous terrain neighborhood mitchell yancey county left without internet week following helenes devastation long hurricane swept southeast cable wired internet customer still reportedly service according fcc last report helene recovery effort oct internet service provider among first ground natural disaster alongside power company first responder department transportation exactly internet provider start come repairing vast network natural disaster especially one destructive hurricane helene locating local internet provider isps disaster recovery effort begin long hurricane ever hit ground require advanced technology repair network devastated storm natural disaster preparation actually start storm said elton hart vice president regional general manager midatlantic area optimum monitoring storm far possibly locating local internet provider optimum repairing internet infrastructure hendersonville nc following hurricane helene midsize internet provider like optimum major company like verizon tmobile disaster recovery plan essential especially mountainous region rural community may limited connectivity hurricane predictable forest fire example isps take preventative measure like topping generator fuel deploying personnel crew standby communicating customer possibility outage helene miltion deployed generator throughout impacted state kept running stacy tindall senior director network engineering operation tmobile told cnet think still running today extended power outage support area tmobile deploying generator following hurricane helene even preparation weather model predicted hurricane helene would hook far appalachia deadly rain historic flooding extent damage road bridge aerial power line fiber cable resulted mass power outage across affected county one time power said hart even connectivity power house power fiber cable network outage top reason internet may shut stay storm isps even fixed wireless isps rely fiberoptic cable infrastructure backhaul network establishing buried fiber cable infrastructure mountainous area difficult expensive aerial fiber network extremely common unfortunately case storm like helene aerial cable first casualty easily damaged falling tree branch strong wind flooded road subsequent mudslide according nc department transportation site damaged road bridge following hurricane helene get network hub damaged fiber optic line isps coordinate dot power company first responder also making way damage zone getting report major delay inability go area still heavily flooded debris clearing taking long time said gina owen associate vice president access engineering operation verizon thats one situation isnt unusual see fiber infrastructure repair delay power come back g wireless internet provider use wired fiber backhaul service case verizon tmobile however wireless internet provider easily navigate damage fiber network using different technology keep people connected following major storm full satellite asset deploy event used lowearth orbit satellite deploy quick get running said owen tmobile response team used variety technology reconnect customer ensuring within hour around site restored service addition testing satellitetocell service starlink tmobile also used cognitive selforganizing network selfheals optimize performance temporary microwave unit remote antenna tilting ensure swift recovery remotely automatically antenna tilt top cell tower expand coverage said tindall antenna tilt hurricane helene milton remote automated even power slowly returned region distressed hurricane helene many household still left without internet mean communicate loved one power come back doesnt mean fiber infrastructure restored said owen although power company may repair pole restore power internet provider may taking path get hart said isps rely multiple fiber path connect home network resplicing fiber network requires time attention detail avoid damaging fiberoptic glass cable due material fiber cable made must respliced strand strand anywhere strand youve got go back every single one reconnected hart said even power internet restored area ongoing repair surrounding network cause subsequent outage various company coordinate resplicing fiber line internet provider saw setback network restoration due expensive repair infrastructure even accidental cut fiber line third party working restore connectivity spectrum one largest internet provider southeastern region reportedly customer still disconnected oct due slow network infrastructure repair destruction network hub skyrunner local provider based asheville reported final helene repair skyrunner infrastructure underway week november nearly six week hurricane helenes devastation although owen said verizon fully restored network georgia oct still lasting impact area rebuilds took lot longer anticipated still dealing two major area within georgia example owen said extensive damage initial damage debris clearing road clearing happening rebuilds happening thing getting cut restoration thing going back addition network restoration effort many isps including tmobile verizon optimum among range internet provider offered free wifi service charging station throughout area affected hurricane helene even internet provider prepared hurricane helene hundred thousand customer experienced longlasting power internet cell outage despite staggering destruction power fiber infrastructure finding mean keeping internet outage using free hotspot reach loved one lifeline,flood,high,"['Carolinas', 'Yancey', 'Southeast', 'Hendersonville', 'NC', 'Verizon', 'Verizon', 'Verizon', 'Earth', 'Southeastern', 'Asheville', 'Georgia', 'Georgia', 'Verizon']",https://www.cnet.com/home/internet/why-isnt-my-internet-back-yet-the-hidden-challenges-of-network-restoration/,2025-03-29T12:00:00Z
devastating landslide hit milford sound pastthe impact would dwarf whakaariwhite island today request blocked server security policy believe error please contact support team,landslide,high,[],https://phys.org/news/2025-03-devastating-landslides-milford-impact-dwarf.html,2025-03-12T15:28:04Z
california official release new fire hazard map check neighborhood,wildfire,unknown,['California'],https://ktla.com/news/california/calfire-fire-hazard-map-2025/,2025-03-24T17:36:43Z
layoff potential closure key facility raise worry noaa future julia simon john ryan jenny staletovich ezra david romero brad reinhart senior hurricane specialist national hurricane center track hurricane beryl first hurricane season national hurricane center july miami joe raedlegetty image hide caption trump administration considering terminating lease property housing vital weather service operation fishery operation according craig mclean former official national oceanic atmospheric administration andrew rosenberg former deputy director noaa national marine fishery service well current noaa contractor spoke condition anonymity fear losing job one potential lease termination includes key weather forecasting center college park md noaa historically employed staff work range issue climate change managing nation multibilliondollar commercial fishery agency monitor forecast extreme weather including hurricane flood provides data feed local tv meteorologist forecast weather apps phone agency also terminating least four expert advisory committee according email npr obtained current noaa contractor email detail termination advisory committee excellence space climate service advisory committee marine coastal areabased management advisory committee marine fishery advisory committee noaa contractor also told npr potential closure maryland weather forecasting facility especially concerning anything getting canceled weather program terrible idea contractor say loss entire facility would hamper ability job predict weather properly help protect people property mclean say lease termination happen would remarkably stupid closure maryland could mean agency would trouble providing accurate forecast serve wide swath people mariner pilot mclean say product college park facility distributed weather forecast office across country noaa part department commerce neither agency responded nprs request comment white house official speaking condition anonymity authorized speak record press said administration reevaluating lease term closing building someone sitting absolutely unlearned level determining contract end say mclean served across several previous administration say conversation current noaa employee there confusion happening destabilizing signage outside noaa headquarters silver spring md hundred employee climate weather research agency fired including least three bay area weather service employee raising concern noaa ability serve public daniel heuerbloomberg via getty image hide caption latest news come noaa began firing least worker part governmentwide layoff ordered trump administration reduce size federal government termination included staff national weather service tasked generating weather forecast million people u rely npr previously reported white house sent memo federal agency director ordering prepare plan largescale reduction force march though picture continues muddled administration frequent policy change well ongoing legal administrative procedure tax dollar siphoned fund unproductive unnecessary program benefit radical interest group hurting hardworking american citizen memo office management budget director russell vought office personnel management acting director charles ezell state call federal government bloated corrupt memo order agency director lay large number staff save money get rid real estate increasing productivity providing better service american people detail cut emerged location across country current former worker noaa said cut threatened key public service weather forecast wildlife management befuddles see unplugging disassembling rather intricate service nation provided federal agency others really making america great mclean say going backwards member station kqed reported least three people national weather service bay area office fired according dalton behringer office union steward national weather service employee organization three employee meteorologist administrative support assistant facility technician probationary distinction indicating relatively new agency current role received email notifying termination supervisor aware according behringer behringer meteorologist bay area office spoke kqed hour union capacity bay area nw office serf million resident across county san francisco monterey bay region already one meteorologist behringer said operate staff remaining employee eligible retirement work fired employee going get spread u already overworked understaffed said staffer laid feb noaa virginia key lab miami including scientist help improve hurricane forecast study valuable fish population noaa hide caption member station wlrn reported nearly two dozen scientist based noaa virginia key office miami laid last thursday according noaa biologist source worked closely agency spoke condition requested anonymity fear losing job funding cut say cut direct hit hurricane research fishery management vital protecting u shore confirmed fired scientist worked fishery half dozen hurricane modeling forecasting one fired andy hazelton meteorologist worked improving hurricane forecast flew repeated mission aboard noaa hurricane hunter plane focused research one pressing concern hurricane intensify suddenly giving little warning public emergency manager hazelton four young kid said working noaa lifelong goal said grew area central florida he experienced hurricane modeling working noaa really dream virginia key lab helped develop nextgeneration hurricane forecasting model part partnership noaa university miami research done hazelton others helped dramatically improve hurricane forecast short amount time latest model hazelton worked improved track forecast intensity forecast according national hurricane center thats allowing forecaster better understand shortfuse storm might explode make landfall lethal cut noaa progress threatened across agency say rick spinrad former noaa administrator biden administration progress made last several year including reducing error track forecast hurricane reducing error intensity forecast think safe say compromised say orca whale known l right swim whale l k pod pacific ocean near mouth columbia river near ilwaco wash day fitted satellite tag one people fired noaa worked protecting whale orca oil spill ship strike fishing gear noaanorthwest fishery science center via ap hide caption hanna miller vacation hawaii opened work email learned longer job last thursday natural resource specialist noaa focused protecting whale oil spill ship strike fishing gear agency find fit continued employment ability knowledge andor skill fit agency current need email vice adm nancy hann deputy undersecretary operation read read enough time read share personal email got locked work account miller told kuow really devastated miller awarded employee year noaa fishery western united state march promoted miller week half completing yearlong postpromotion probation fired miller helped multiagency team make sure endangered orca didnt swim diesel fuel belching sunken aleutian isle fishing boat washington san juan island call day tracking every second awake make sure didnt go oil spill miller said per longstanding practice discussing internal personnel management matter noaa spokesperson james miller emailed response kuow interview information request public servant people dedicated protecting well case protecting specie ocean miller said could taken higherpaying job field weve chosen one care edited sadie babits rachel waldholz sponsor message become npr sponsor,flood,unknown,"['Miami', 'College Park', 'Md.', 'Maryland', 'Maryland', 'College Park', 'Silver Spring', 'Md.', 'Bay Area', 'U.S.', 'America', 'Bay Area', 'Bay Area', 'The Bay Area', 'San Francisco', 'Monterey Bay', 'Miami', 'Miami', 'U.S.', 'Central Florida', 'the Pacific Ocean', 'the Columbia River', 'Ilwaco', 'Wash.', 'orcas', 'Hawaii', 'United States', 'orcas', 'Aleutian Isle', 'Washington', 'San Juan Island']",https://www.npr.org/2025/03/06/nx-s1-5316917/noaa-trump-impact-layoffs,2025-03-06T12:00:00Z
caused magnitude myanmar thailand earthquake march min read earthquake myanmar thailand devastating magnitude earthquake myanmar caused widespread shaking likely considerable damage lack building built withstand temblor robin george andrew edited andrea thompson resident carry belonging debris next damaged building naypyidaw march earthquake central myanmar sai aung mainafp via getty image march around midday local time ten million people southeast asia felt earth foot violently rupture magnitude earthquake centered mile away mandalay myanmar shook regioncausing street buckle ancient pagoda crumble bridge shatter house collapse entire neighborhood devastated matter second earthquake energy release comparable several hundred nuclear weapon explosion magnitude event high felt neighboring country say amilcar carreracevallos earthquake scientist vicente rocafuerte secular university guayaquil ecuador story skyscraper construction bangkok mile quake epicenterdisintegrated according estimate u geological survey thousand ten thousand casualty well ten billion dollar economic damage many factor conspired make earthquake disaster including lack quakeproofing measure building across region structure could withstand monster temblor really big shallow earthquakemeaning occurred relatively close earth surface say judith hubbard earthquake scientist cornell university youre enjoying article consider supporting awardwinning journalism subscribing purchasing subscription helping ensure future impactful story discovery idea shaping world today around million year ago indian tectonic plate collided eurasian plate former started descend beneath latter crumbled crust middle refer himalaya today mountain range entire region filled fault generated epic geological pileup indian plate still slowly running eurasia myriad fault take lot stress result time time rupture march event especially gargantuan rupture along one specific schism available data far strongly suggest rupture sagaing fault say robin lacassin earthquake scientist paris institute earth physic major northsouth strikeslip fault one two block crust slide past bit like san andreas fault california sagaing fault main strikeslip boundary side indian plate lacassin say responsible many strong destructive earthquake past car pas damaged road naypyidaw march earthquake central myanmar sai aung mainafp via getty image hubbard point may fault ruptured generated magnitude temblor causing modest degree destruction particularly perilous fault least nay pyi taw capital city myanmar lie directly atop today magnitude rupture exponentially powerful event earthquake measured modified mercalli intensity scale gauge shaking intensity based surface observation close epicenter nearly million people felt quake ix violent scale many building werent damaged also thrown literally shifted foundation slightly farther epicenter shaking ranked severe strongand onlooker thailand shocked see building receive damage well preliminary data suggest seismic wave traveled far source channeled along southern section sagaing fault would explain damage bangkok report felt far away carreracevallos say earthquake like horrific reminder disaster purely referred natural today quake powerful yesbut city blast zone didnt stand chance decidedly human factor earthquake occurred area earthquakeresistant building inadequate building code carreracevallos say although design building guarantee hold mightiest earthquake fit dampener architecture allow safely sway event temblor even older structure retrofitted include various form quakeresistant technology damage thailand shocking unlikely severe shaking less intense myanmar highrise skyscraper collapsed thailand construction probably outlier expect much worse myanmar hubbard say myanmar political situation work recovery effort military coup ongoing civil war already displaced million people home quake going dramatically inflate number exacerbating already extensive humanitarian crisis strong aftershock shake city town village several week come also impeding likely chaotic recovery effort robin george andrew volcanologist science writer based london recent book kill asteroid ww norton follow x squigglyvolcano learn share exciting discovery innovation idea shaping world today follow u scientific american part springer nature owns commercial relation thousand scientific publication many found wwwspringernaturecomus scientific american maintains strict policy editorial independence reporting development science reader scientific american division springer nature america incall right reserved,earthquake,high,"['Myanmar', 'Thailand', 'Myanmar', 'Thailand', 'Myanmar', 'Naypyidaw', 'Myanmar', 'Southeast Asia', 'Mandalay', 'Myanmar', 'Ecuador', 'Earth', 'Eurasia', 'the San Andreas Fault', 'California', 'Naypyidaw', 'Myanmar', 'Myanmar', 'Thailand', 'Bangkok', 'nt', 'Thailand', 'Myanmar', 'Thailand', 'Myanmar', 'Myanmar', 'London']",https://www.scientificamerican.com/article/what-caused-the-magnitude-7-7-myanmar-and-thailand-earthquake/,2025-03-28T18:30:00Z
yahoo tsunami billboard kind horrifying recently reappeared reddit purchase link site may earn affiliate commission here work back striking billboard appeared across entire height building opposite japan shibuya station marking sixth anniversary thoku earthquake tsunami claimed ten thousand life ad recently reappeared reddit provoking emotional response ad includes bold red line indicates height tsunami would looked reached shibuya shocking demonstration sheer scale power natural disaster one like best billboard ad lingers mind long viewed translated billboard read six year already passed since great east japan earthquake iwate prefecture ofunato city maximum height tsunami observed meter happened middle ginza would exactly red line height knowing high action take change make preparation image billboard currently top post reddits rdesignporn page feel twist heart see one x user comment another add forget fear shock day ad certainly powerful also provoking another kind unease fact ultimately promoting brand case yahoo japan isnt sitting well everyone forget day best form disaster prevention yahoo belief read final line ad piggy backing tragedy ad dystopian read one reddit comment another add incredible message jarred last line yahoo another user pithily summarises billboard reminder definitely best form disaster prevention lol still certainly powerful sobering ad design inspiration take look best print ad time daily design news review howtos picked editor thank reading article month join unlimited access enjoy first month read free article per month without subscription join unlimited access try first month daniel john design editor creative bloq report world design branding lifestyle tech covered several industry event including milan design week offf barcelona adobe max los angeles please logout login prompted enter display name creative bloq part future plc international medium group leading digital publisher visit corporate site future publishing limited quay house ambury bath ba ua right reserved england wale company registration number,earthquake,unknown,"['Reddit', 'Japan', 'Reddit', ""Iwate Prefecture's"", 'Ofunato City', 'Ginza', 'Reddit', 'Yahoo Japan', 'Piggy', 'Barcelona', 'Los Angeles', 'England']",https://www.creativebloq.com/design/print-design-publishing/yahoos-tsunami-billboard-is-all-kinds-of-horrifying,2025-03-20T11:55:42Z
bbc reporter scramble storey building reduced three floor rubble sun set bangkok hundred rescue worker desperately search survivor collapsed storey skyscraper construction site thailand capital rescuer trying reach dozen worker trapped rubble skyscraper collapsed standing bridge short distance scene orange glow sky group reporter including look disbelief threestoreyhigh pile concrete twisted wire metal jut even professional rescue military team arrive floodlight erected seems little chance finding many survivor shallow magnitude quake hit central myanmar followed minute later magnitude aftershock toppling building rupturing road across border thailand shock devastation also felt resident struggle respond natural disaster accustomed house shake started unlike anything felt collapsed building belonging national audit office construction three year cost two billion thai baht reduced rubble white tent erected perimeter rescuer bright yellow hard hat work free estimated people still trapped beneath collapsed skyscraper thai defence minister phumtham wechachai told reporter three people confirmed dead earlier saw two covered body carried tent road next building full fire engine ambulance rescue vehicle curious civilian joined u bridge watching attempt understand happening heavy machinery beginning arrive including large crane rescuer say need remove debris start searching missing arrived less hour collapse find construction worker covered dust stunned survived adisorn kamphasorn bringing material sixth floor suddenly felt tremor yearold looked stairwell saw crane shaking told knew bad ran took one minute collapse sudden smoke everywhere everything went black couldnt breathe didnt mask spoken family yet lost phone chaos saying never experienced anything like life thought going die construction worker tell mixture thai burmese nukul khemutha working fifth floor felt tremor looked saw floor sinking hole forming said one colleague gone tenth floor use bathroom still waiting news whereabouts told screaming run telling hold hand run together spoke sat smoking trying calm looked sad none survivor received medical help attention focused still trapped sound drilling intensifies rescue worker face long night ahead additional reporting rachel hagan london people died thousand displaced myanmar rescue relief worker seeking access worst quakehit area blocked military bbcs yogita limaye first foreign journalist enter country since disaster struck say truce effect april speed relief effort last week deadly earthquake cornishbased charity say received generous donation part appeal copyright bbc right reserved bbc responsible content external site read approach external linking,earthquake,low,"['Bangkok', 'Thailand', 'Myanmar', 'Thailand', 'Khemutha', 'London', 'Myanmar']",https://www.bbc.com/news/articles/c4g0gr8gl0wo,2025-03-28T13:14:26Z
