text,disaster_type,severity,locations,url,published_at
spacexs latest starship explosion mark two consecutive failure spacexs starship launcher spun control minute liftoff thursday showering fiery debris bahamas dealing another setback elon musk rocket program failure similar circumstance less two month ago starship super heavy booster loaded million pound methane liquid oxygen propellant lumbered launchpad texas pm central time begin eighth fullscale test flight spacexs newgeneration rocket thirtythree raptor engine propelled foottall meter rocket clear afternoon sky twice power nasa saturn v rocket workhorse apollo lunar program repeating feat spacex accomplished starship twice rocket super heavy booster separated starship upper stage roughly twoandahalf minute flight guided back texas coastline catch mechanical arm launchpad tower spacex attempt catch super heavy booster back launch site sign engineer well way mastering recover reuse booster similar way smaller workhorse falcon rocket story originally appeared ar technica trusted source technology news tech policy analysis review ar owned wireds parent company cond nast spacex test flight newest version starship called block version first six starship test flight used initial version ship spacex modernizing fleet starship block stand slightly taller first version order accommodate additional propellant starship block also debut smaller forward flap give hardware another layer protection scorching heat reentry notable change block redesigned fuelline system feed propellant ship six raptor engine good news many starship construction south texas spacex likely wont wait long try company started year aiming many starship test flight end first quarter year two today minor setback wrote elon musk spacexs ceo x progress measured time next ship ready week spacex starship flight launch orbital launch pad boca chica beach march boca chica beach texas spacex contract nasa worth approximately billion design develop humanrated moon lander based starship design starship lander central piece nasa architecture artemis program aim return astronaut lunar surface later decade starship fly moon spacex must refill supercold propellant lowearth orbit something one done scale musk see starship interplanetary backbone transporting cargo people mar one consistent longterm goal requires orbital refueling musk recently suggested spacex could ready demonstrate shiptoship orbital refueling year later goal nasa official discussed december starship also launch spacexs nextgeneration starlink internet satellite thursday launch ground crew loaded four starlink mockups inside starship payload bay test rocket deployment mechanism official eager assess performance starship block heat shield committing attempt recover ship intact like spacex already super heavy booster future mission premature ending test flight mean objective must wait spacex oversees starship using iterative development cycle engineer come new design rapidly test incorporate lesson learned next rocket surprising see rocket blow using spiral development cycle backtoback failure especially many similarity may point fundamental issue flight plan going thursday mission called sending starship journey halfway around world texas culminating controlled reentry indian ocean splashing northwest australia test flight supposed doover previous starship flight january rocket upper stageitself known starship shipsuccumbed fire fueled leaking propellant engine bay engineer determined likely cause propellant leak harmonic response several time stronger predicted suggesting vibration ship climb space resonance vehicle natural frequency would intensified vibration beyond level engineer expected super heavy booster returned starbase texas caught back launch pad engineer testfired starship vehicle earlier month week test flight validating change propellant temperature operating thrust ship fuel feed line leading six raptor engine engineer missed something thursday raptor engine began shutting starship eight minute flight rocket started tumbling mile kilometer southeastern gulf mexico spacex ground controller lost contact rocket nineandahalf minute liftoff prior end ascent burn energetic event aft portion starship resulted loss several raptor engine spacex wrote x turn led loss attitude control ultimately loss communication starship like january resident tourist across florida peninsula bahamas turk caicos island shared video fiery debris trail appearing twilight sky air traffic controller diverted delayed dozen commercial airline flight flying debris footprint response january incident immediate report thursday starship wreckage falling populated area january resident turk caicos recovered small debris fragment including one piece caused minor damage struck car debris field thursday failed flight appeared fall west area debris fell starship flight spokesperson u federal aviation administration said regulatory agency require spacex perform investigation thursday starship failure story originally appeared ar technica inbox upgrade life wiredtested gear avoid usbased digital service might want big story inside elon musk digital coup airport theory make miss flight special edition get computersbefore computer get wired review guide cond nast right reserved wired may earn portion sale product purchased site part affiliate partnership retailer material site may reproduced distributed transmitted cached otherwise used except prior written permission cond nast ad choice,wildfire,low,"['Bahamas', 'Texas', 'Texas', 'Starship', 'South Texas', 'Boca Chica', 'Boca Chica Beach', 'Texas', 'Earth', 'Mars', 'Texas', 'the Indian Ocean', 'Australia', 'Starbase', 'Texas', 'Gulf of Mexico', 'Florida', 'Bahamas', 'US']",https://www.wired.com/story/the-starship-program-hits-another-speed-bump-with-second-consecutive-failure/,2025-03-08T04:00:00Z
heathrow airport closure may cost airline hundred million dollar could even worse london heathrow airport closed friday due power outage crippling flight region better part day fallout cost airline pretty penny timing could much worse thousand passenger expecting london spent hour air end back place like tokyo mumbai dallas australia flag carrier qantas said passenger diverted paris would transported london via bus ninehour journey heathrow said would restart flight late friday meaning traveler could get back track sooner expected reorganizing airline network easy task diversion cancellation leave plane crew unexpected place luckily heathrow airline call home especially british airway power outage fixed less day occur crowded travel time like summer holiday year natural disaster infrastructure problem grounded airline airport operation depending severity left thousand million people stranded many peak travel season lasted day think good thing sort preeaster bit march lull moment ronan murphy director alton aviation consultancy told business insider middle july would absolute disaster could another flight estimate airline could lose million incur expense rerouting passenger providing accommodation many airline trying curb ripple effect get plane heading heathrow reopens united airline said plan operate scheduled friday flight london also offered reroute passenger airport like brussels amsterdam british airway said cleared operate eight longhaul flight place like johannesburg singapore friday flight take half hour heathrow first closed according aviation analytics firm cirium flight scheduled take land heathrow friday capacity seat heathrow world fifthbusiest airport rank second passenger flying internationally think load factor let say full average thats people give take affected could millionplus revenue one day murphy told bi said airline wouldnt lose many passenger could rerouted choose rebook later date added heathrow still hugely profitable vital airport many carrier around world unprecedented situation seen closure heathrow scale many year british airway ceo sean doyle said unfortunately huge impact customer flying u coming day capacity million seat last year new yorkjfk london heathrow corridor poised among hardest hit th busiest route world busiest outside asia according data oag flight jfk heathrow thursday night friday morning canceled diverted flightaware data show friday night flight yet disrupted friday afternoon around hour shutting heathrow announced safely able restart flight prioritizing repatriation relocation aircraft getting plane heathrow important step recovering operation clearing backlog future scheduled flight take travel expert mike arnot told bi cost could hundred million dollar large airline typically spare capacity take advantage alliance partner im hopeful incident turn molehill mountain said airline earn billion revenue diversion weather hurricane season wintry mix mechanical issue cause irregular operation part business eruption iceland eyjafjallajkull volcano released ash atmosphere creating widespread chaos air travel busy spring break travel period according international air transport association eruption closed hundred airport across much europe airspace week canceled flight impacted million people airline lost billion revenue usuk market major moneyloser accounting million revenue day handful recent meltdown snowballed due misplaced plane crew broken infrastructure also halted travel bled airline cash january winter storm swept southeast u affected operation airport like atlanta new orleans houston thousand flight passenger disrupted airport shut month wildfire los angeles also affected several airport across southern california investor conference hosted jpmorgan march delta air line ceo ed bastian said january disaster cost carrier million delta also lost million botched crowdstrike update caused mass meltdown july peak summer travel season airline affected outage recovered relatively quickly delta problem lasted five day led nearly flight cancellation southwest airline experienced meltdown december outdated scheduling software lost track pilot flight attendant causing nearly flight cancellation ripple effect occurred holiday period chaos cost southwest billion including civil penalty payment department transportation reimbursement refund passenger jump,hurricane,high,"['London', 'London', 'Tokyo', 'Mumbai', 'Dallas', 'Australia', 'Paris', 'London', 'London', 'Brussels', 'Amsterdam', 'Johannesburg', 'Singapore', 'New York-JFK', 'London', 'Asia', 'Iceland', 'Europe', 'US', 'UK', 'US', 'Atlanta', 'New Orleans', 'Houston', 'Los Angeles', 'Southern California', 'Southwest']",https://www.businessinsider.com/heathrow-airport-power-outage-ccould-cost-airlines-millions-2025-3,2025-03-21T18:47:54Z
china authorizes controversial hydropower project landslideprone region tibet request blocked server security policy believe error please contact support team,landslide,unknown,"['China', 'Tibet']",https://phys.org/news/2025-03-china-authorizes-controversial-hydropower-landslide.html,2025-03-24T16:10:01Z
ai coding assistant refused write codeand suggested user learn last saturday developer using cursor ai racing game project hit unexpected roadblock programming assistant abruptly refused continue generating code instead offering unsolicited career advice according bug report cursor official forum producing approximately line code user call locs ai assistant halted work delivered refusal message generate code would completing work code appears handling skid mark fade effect racing game develop logic ensures understand system maintain properly ai didnt stop merely refusingit offered paternalistic justification decision stating generating code others lead dependency reduced learning opportunity cursor launched aipowered code editor built external large language model llm similar powering generative ai chatbots like openais gpto claude sonnet offer feature like code completion explanation refactoring full function generation based natural language description rapidly become popular among many software developer company offer pro version ostensibly provides enhanced capability larger codegeneration limit story originally appeared ar technica trusted source technology news tech policy analysis review ar owned wireds parent company cond nast developer encountered refusal posting username janswist expressed frustration hitting limitation h vibe coding pro trial version sure llm know lol doesnt matter much fact cant go locs developer wrote anyone similar issue really limiting point got h vibe coding one forum member replied never saw something like file loc codebase still waiting refactoring never experienced thing cursor ai abrupt refusal represents ironic twist rise vibe codinga term coined andrej karpathy describes developer use ai tool generate code based natural language description without fully understanding work vibe coding prioritizes speed experimentation user simply describe want accept ai suggestion cursor philosophical pushback seems directly challenge effortless vibesbased workflow user come expect modern ai coding assistant isnt first time weve encountered ai assistant didnt want complete work behavior mirror pattern ai refusal documented across various generative ai platform example late chatgpt user reported model became increasingly reluctant perform certain task returning simplified result outright refusing requestsan unproven phenomenon called winter break hypothesis openai acknowledged issue time tweeting weve heard feedback gpt getting lazier havent updated model since nov th certainly isnt intentional model behavior unpredictable looking fixing openai later attempted fix laziness issue chatgpt model update user often found way reduce refusal prompting ai model line like tireless ai model work without break recently anthropic ceo dario amodei raised eyebrow suggested future ai model might provided quit button opt task find unpleasant comment focused theoretical future consideration around contentious topic ai welfare episode like one cursor assistant show ai doesnt sentient refuse work imitate human behavior specific nature cursor refusaltelling user learn coding rather rely generated codestrongly resembles response typically found programming help site like stack overflow experienced developer often encourage newcomer develop solution rather simply provide readymade code one reddit commenter noted similarity saying wow ai becoming real replacement stackoverflow need start succinctly rejecting question duplicate reference previous question vague similarity resemblance isnt surprising llm powering tool like cursor trained massive datasets include million coding discussion platform like stack overflow github model dont learn programming syntax also absorb cultural norm communication style community according cursor forum post user hit kind limit line code appears truly unintended consequence cursor training cursor wasnt available comment press time weve reached take situation story originally appeared ar technica inbox upgrade life wiredtested gear avoid usbased digital service might want big story inside elon musk digital coup airport theory make miss flight special edition get computersbefore computer get wired review guide cond nast right reserved wired may earn portion sale product purchased site part affiliate partnership retailer material site may reproduced distributed transmitted cached otherwise used except prior written permission cond nast ad choice,,high,"['Cursor', 'Cursor', 'AI', 'Cursor', 'AI', 'AI', 'Cursor', 'AI', 'AI', 'AI', 'AI', 'Cursor', 'AI', 'Cursor', 'AI', 'Cursor', 'Cursor', 'Cursor', 'Cursor', 'US']",https://www.wired.com/story/ai-coding-assistant-refused-to-write-code-suggested-user-learn-himself/,2025-03-15T09:00:00Z
youre even allowed trump cry energy war canada heat trade war united state canada heating past hour ontario premier doug ford u president donald trump circled like monkey fighting dominance wild canada said would put surcharge energy export u trump threw fit social medium announced new tariff side appear backing monday ford announced surcharge power ontario export michigan minnesota new york move expected hit million home people state around day necessary united state escalates hesitate shut electricity completely ford said announced fee trump pitched fit truth social ford speech despite fact canada charging usa tariff many farm product ontario announced surcharge electricity thing sic even allowed said trump post ford spoke u secretary commerce howard lutnick agreed rescind energy surcharge secretary lutnick agreed officially meet premier ford washington thursday march alongside united state trade representative discus renewed usmca ahead april reciprocal tariff deadline pair said joint statement response ontario agreed suspend percent surcharge export electricity michigan new york minnesota canada fact allowed america canada complex closeknit relationship based trade lot trade happens energy u export energy import energy canada study center strategic international study dc area think tank mapped complex web relationship two country revealing energy moving two country account around billion bilateral revenue crossborder petroleum natural gas pipeline around terawatt hour trillion watt move across major transmission point u canada ontario alone exported trillion watt united state canada generates incredible amount energy sitting enormous reserve natural gas mineral u natural resource giant well major energy exporter global stage long benefited cheap access canadian energy there uranium canada one leading exporter radioactive rock thats critical construction nuclear power plant time reserve united state u want build lot nuclear power plant trump directed big tech demanding uranium could another energy paint point canadian play trump trump came office promising turn canada st state antagonized neighbor north leveled tariff bring negotiating table want negotiate isnt always clear canada leader seem ready brawl didnt ask fight canadian always ready someone else drop glove american make mistake trade hockey canada win incoming canadian prime minister mark carney said acceptance speech sunday there expression end find ben cahill nonresident expert energy security csis worked energy trade map said post x start phrase fuck around trump escalated trade war tuesday morning announcing additional tariff canadian steel aluminum shortly declaring national emergency electricity within threatened area allow u quickly done alleviate abusive threat canada trump said post truth social trump said could go away canada would simply join united state thing make sense canada become cherished fifty first state said canadadonald trumpenergy get best tech science culture news inbox daily news future delivered present please select desired newsletter submit email upgrade inbox temporary layoff show realworld impact uncertainty trump created trump ally say want ensure congress voice trade policy baseline tariff hit april larger tariff coming effect april elon musk become donald trump special envoy midterm election said one democratic party leader billionaire oligarch money failed buy judge tuesday email may earn commission buy link site gizmodo usa llc right reserved mode follow u mode follow u,,high,"['Canada', 'the United States', 'Canada', 'U.S.', 'Canada', 'U.S.', 'Ontario', 'Michigan', 'Minnesota', 'New York', 'the United States', 'Canada', 'USA', 'Ontario', 'U.S.', 'Washington', 'Ontario', 'Michigan', 'New York', 'Minnesota', 'Canada', 'America', 'Canada', 'U.S.', 'Canada', 'D.C.', 'U.S.', 'Canada', 'Ontario', 'the United States', 'Canada', 'U.S.', 'Canada', 'the United States', 'U.S.', 'Big Tech', 'Canada', 'Canada', '\x80\x98and', 'U.S', 'Canada', 'Canada', 'the United States', 'Canada']",https://gizmodo.com/youre-not-even-allowed-to-do-that-trump-cries-as-energy-war-in-canada-heats-up-2000574554,2025-03-11T19:50:24Z
government vow clean england largest lake environment secretary steve reed pledged work towards ensuring rainwater enters england largest lake speaking visit windermere reed said government would work water company local authority cumbria environmental group draft feasibility study eliminate discharge lake currently treated wastewater untreated sewage time discharged lake scientist say contributed algal blooming water turn green united utility water company serf windermere said committed improving water quality spending wastewater treatment revealed firm repeatedly discharged million litre raw sewage illegally lake threeyear period reed told bbc breakfast wholly unacceptable lake allowed contaminated much pollution million litre reed offer detail discharge windermere would stopped would almost certainly require large network new sewage pipe take wastewater sewage away last year united utility published feasibility study concluded would require mile km new pipe take discharge downstream mile km new network connect private sewage facility study costed likely hundred million pound part lake district national park unesco world heritage site windermere home people scenery attracts estimated seven million visitor per year matt staniek campaigner sewage pollution founder save windermere invited part feasibility study said announcement felt like new dawn windermere remained cautious adding far objective vision ambition want see absolutely concrete want see legally binding commitment going continue campaign happens asked water windermere might safe enough swim reed told bbc breakfast wont ready quickly summer taken long time get state however nigel wilkinson managing director windermere lake cruise said minister comment simply true windermere safe bathe official data quality bathing water rated windermere excellent last survey september mr wilkinson said simply true absolutely disastrous visitor economy windermere great swim coming june people swimming lake misinformation absolutely appalling first step government said looking new way reduce pollution private sewage discharge windermere included new treatment plant along scheme would let owner septic tank package treatment work ask connection main sewer certain condition part scheme united utility spending upgrade nine wastewater treatment work windermere said would reduce spill six storm overflow discharging lake though money initially come investor ultimately paid increased customer bill next five year united utility customer average see bill rise rate inflation clear long take windermere feasibility study completed plan approved could raise bill reed said government committed cleaning iconic lake working range local group organisation stop sewage going lake restore natural beauty united utility spokesperson said already invested cut pollution lake added today announcement government look longterm plan rainfall entering windermere working partner involved support follow bbc cumbria x facebook nextdoor instagram new report say condition environmentallysensitive area northern ireland declining venue kendal say every effort made try sell business going concern sellafield say disappointed figure step taken tackle gap service asks people act responsibly tackling blaze take resource elsewhere improved wetland rspb geltsdale see return redshank oystercatcher copyright bbc right reserved bbc responsible content external site read approach external linking,wildfire,unknown,"['England', 'England', 'Cumbria', 'the Lake District', 'Windermere', 'Windermere', 'Northern Ireland', 'Kendal']",https://www.bbc.com/news/articles/cm2je1djrm2o,2025-03-10T06:02:16Z
addressing need vulnerable population unable move away climate risk area request blocked server security policy believe error please contact support team,,unknown,[],https://phys.org/news/2025-03-vulnerable-populations-unable-climate-areas.html,2025-03-17T16:53:16Z
noem proposes cutting fema disaster response fall local state authority,,unknown,[],https://subscriber.politicopro.com/article/eenews/2025/03/27/local-disaster-officials-prepare-for-a-world-without-fema-00252054,2025-03-27T15:30:00Z
