text,disaster_type,severity,locations,url,published_at
cybersecurity professor faced china funding inquiry disappearing source say official faculty profile renowned indiana university bloomington iu data privacy professor xiaofeng wang wife disappeared fbi raided two couple home last week school said reviewing month whether professor received unreported research funding china wired learned indiana university contacted wang december ask grant china listed wang researcher according unsigned statement appears written purdue university professor longtime collaborator wang seen wired statement say author believed iu concerned wang allegedly failed properly disclose funding university application u federal research grant statement circulating among cybersecurity privacy scholar university around world recent day sent wired three separate source claim wang explained funding situation iu told february school would continue looking matter alex tanford professor emeritus indiana university iu bloomington chapter president american association university professor say wang reached said accused alleged research misconduct tanford say provided wang guidance member faculty board review iu answer wireds question regarding probe wang charge seemed trivialthat failed properly disclose principal investigator grant application fully listed coauthor article tanford tell wired allegation say wang wanted know university right lock office computer middle ongoing research research paper wang published list funding place like national science foundation national institute health u defense advanced research project agency u army research office google samsung according wired review publication time period wang regularly collaborated researcher institute information engineering iie chinese academy science governmentfunded cybersecurity research lab paper wang coauthor disclosed iie scholar received funding source national natural science foundation china wang supported u grant uncommon professor u institution collaborate researcher china there public evidence suggest arrangement improper according unsigned statement title metadata appears authored ninghui li computer science professor purdue collaborated research wang since least pair also serve together board acm special interest group security audit control sigsac aim develop information security profession sponsoring high quality research conference workshop according association computer machinery website li respond emailed request comment voicemail left office phone jason covert one attorney representing xiaofeng wang wife nianli library system analyst whose employee profile also removed indiana university tell wired wang safe neither arrested legal team currently aware pending criminal charge couple attorney viewed search warrant department justice covert say received copy affidavit establishing probable cause wang considered among top researcher field privacy data security biometric privacy sudden disappearance came shock many academic peer wang joined iu lead principal investigator multidisciplinary center distributed confidential computing established almost million grant national science foundation nsf according sincedeleted bio ius website part application nsf funding u federal research grant wang would required disclose grant already received currently pending review march fbi searched two home address associated wang day iu also reportedly terminated wangs job via email sent provost rahul shrivastav wired obtained first reported indiana daily student email also said understood wang recently accepted position university singapore detail also repeated statement attributed li statement say wang planned start unnamed singaporean university june requested leave absence indiana university early march iu responded putting administrative leave removing iu homepage disabling iu email address claim wangs new job offer would irrelevant event next academic year would justify firing tanford say terminating employment via email violation university policy tanford claim prohibits firing tenured professor without cause requires day notice hearing faculty board review requested staff member faculty deeply concerned administration fire tenured professor without due process violation policy approved trustee none u safe say reached comment iu spokesperson declined answer detailed question wired prior communication university wang school decision fire indiana university recently made aware federal investigation indiana university faculty member university spokesperson mark bode tell wired emailed statement direction fbi indiana university make public comment regarding investigation accordance indiana university practice indiana university also make public comment regarding status individual fbi far commented reason activity surrounding wangs property statement sent wired indianapolisbased spokesperson chris bavender say fbi conducted court authorized law enforcement activity home carmel bloomington indiana last friday comment time wired could immediately reach wang comment directly covert attorney provided statement behalf prof wang m thankful outpouring support received colleague indiana university peer across academic community statement read look forward clearing name resuming successful career conclusion investigation many academic research community event surrounding wang another chineseborn scholar florida fired recently reminiscent china initiative u department justice campaign launched first trump administration combat cybercrime economic espionage critic accused program unfairly targeting chineseborn researcher broader asianimmigrant asianamerican academic community doj abandoned program biden administration lost withdrew charge number associated case time top doj official said helped give rise harmful perception lower standard prosecuting conduct related china people tie country treated differently several congressional effort since sought resurrect program start similar law enforcement campaign including bill passed house senate last year like many organization individual broad concern end china initiative name reflect change fact substance jeremy wu coorganizer apa justice nonprofit organization advocate racial profiling said march webinar michigan state university wu declined wireds request comment event surrounding wang matthew green professor john hopkins university specializes cryptography cryptographic engineering say doesnt know wang personally troubled secretive indiana university circumstance led alleged firing normal behavior university green tell wired green say worry case like wangs could make young engineer china think twice studying american university even motivate talented researcher lived u decade instead consider working abroad may lose huge amount expertise green say inbox upgrade life wiredtested gear avoid usbased digital service might want big story inside elon musk digital coup airport theory make miss flight special edition get computersbefore computer get wired review guide cond nast right reserved wired may earn portion sale product purchased site part affiliate partnership retailer material site may reproduced distributed transmitted cached otherwise used except prior written permission cond nast ad choice,wildfire,low,"['China', 'WIRED', 'China', 'IU', 'US', 'IU', 'US', 'US', 'China', 'IU', 'IU', 'US', 'IU', 'Singapore', 'IU', 'WIRED', 'Indianapolis', 'Bloomington', 'Indiana', 'Florida', 'China', 'China', 'US', 'US']",https://www.wired.com/story/xiaofeng-wang-indiana-university-research-probe-china/,2025-04-02T17:31:26Z
saturn secures title moon king major haul new moon saturn solidified title moon king updated tally satellite orbiting gas giant recordbreaking statistic put saturn way ahead moonbearing competitor ringed planet officially orbited almost twice many moon planet solar system combined international team astronomer made recent discovery new moon around saturn using canada france hawaii telescope saturn regained title moon king last year discovery new moon bringing total moon planet main competition solar system jupiter confirmed moon two gas giant locked battle moon orbit year may safe say saturn contest landslide based projection dont think jupiter ever catch edward ashton postdoctoral fellow institute astronomy astrophysics academia sincia lead researcher behind discovery said university british columbia statement research team monitored sky around saturn canada france hawaii telescope combining multiple telescope improve signal astronomical object sky survey initially yielded moon well many object could identified astronomer revisited sky field three month confirm identity remaining objectsthat confirm object moon week international astronomical union recognized team discovery newly discovered moon considered irregular meaning theyre tiny fragment larger moon likely broke apart violent collision saturnian moon passing comet according researcher new moon near mundilfari subgroup saturn moonsthe likely site collision took place within last million year within saturnian system breaking larger body recently idd satellite carefully planned multiyear campaign yielded bonanza new moon tell u evolution saturn irregular natural satellite population ashton said team done moon spotting foreseeable future existing technology likely reached limit come detecting new moon around distant planet saturn uranus neptune saturn hold onto crown solar system moon king astronomyjupitermoonssaturn get best tech science culture news inbox daily news future delivered present please select desired newsletter submit email upgrade inbox rare event revealed neverbeforeseen behavior planetary atmosphere nearby corona borealis system could still explode day calculation suggest next best chance firework later year march moon wedge sun earth blocking part star view rare nova explosiononce happenswill bright youll able spot without telescope skywatchers get rare chance see saturn full glory without chunk ice rock swarming around astronomer using webb space telescope spotted giganticand growingprimordial galaxy may earn commission buy link site gizmodo usa llc right reserved mode follow u mode follow u,wildfire,high,"['Canada', 'France', 'Hawaii', 'Jupiter', 'Jupiter', 'Canada', 'France', 'Hawaii', 'Saturn\x80\x99s', 'Sun', 'Earth']",https://gizmodo.com/saturn-secures-its-title-as-the-moon-king-with-major-haul-of-new-moons-2000575070,2025-03-12T21:00:55Z
mba survey share mortgage loan forbearance decrease february calculated risk pm mba share mortgage loan forbearance decrease slightly february mortgage banker association mba monthly loan monitoring survey revealed total number loan forbearance decreased basis point servicers portfolio volume prior month february according mba estimate homeowner forbearance plan mortgage servicers provided approximately million forbearance since march share fannie mae freddie mac loan forbearance decreased basis point february ginnie mae loan forbearance decreased basis point forbearance share portfolio loan privatelabel security pls decreased basis point despite february monthly decline loan forbearance estimated number forbearance loan workout increased compared one year ago said marina walsh cmb mba vice president industry analysis yearoveryear gain may attributed increasing escrow payment tax insurance inflationary pressure natural disaster aging servicing portfolio softening labor market time performance loan workout overall servicing portfolio weakened compared one year ago reason borrower forbearance reason temporary hardship caused job loss death divorce disability another forbearance natural disaster remaining borrower still forbearance covid emphasis added end february homeowner forbearance plan,,low,[],https://www.calculatedriskblog.com/2025/03/mba-survey-share-of-mortgage-loans-in.html,2025-03-17T23:01:00Z
french court bar farright leader marine le pen public office embezzlement rebecca rosman french farright leader marine le pen arrives paris court expected deliver verdict embezzlement case could shake french politics derail farright leader marine le pen career monday march paris thibault camusap hide caption paris ruling could reshape france political future french court monday convicted farright leader marine le pen embezzlement barred running public office five year decision effectively remove presidential race seen leading candidate le pen say file appeal went french television broadcaster tf monday evening criticized ruling political decision rule law totally violated decision said adding would appeal soon possible million french people outraged said france country human right judge applied law thought apply authoritarian regime le pen head national rally rn party also sentenced four year prison two year suspended two house arrest along fine convicted along codefendant including senior rn figure case centered allegation misused million million european parliament fund cover rn party expense even though le pen vowed appeal process could drag month even year even retrial occurs presidential election remains uncertain whether initial ruling would overturned jordan bardella rn president le pen political protg quickly denounced ruling today marine le pen unjustly condemned french democracy executed wrote social medium le pen sidelined bardella expected step rn presidential candidate yearold played central role broadening party support question remain experience ability appeal broad enough electorate win national race u state department spokesperson tammy bruce drew parallel french court decision president trump previous legal battle exclusion people political process particularly concerning given aggressive corrupt lawfare waged president trump united state told reporter washington support right everyone offer view public square agree disagree le pen dominant force french politics ever since succeeding father jeanmarie le pen rn party leader gained favor broadening party appeal moving closer political mainstream journal du dimanche poll released last saturday indicated strong position polling favorable scenario point higher firstround result around world farright politician swiftly condemned ruling portraying politically motivated persecution brazil former president jair bolsonaro told reuters ruling clearly leftwing judicial activism wherever right wing present left system work get opponent game hungarian prime minister viktor orbn expressed support le pen writing social medium je suis marine marine echo je suis charlie slogan emerged support french satirical magazine charlie hebdo employee targeted deadly attack paris dmitry peskov spokesperson russian president vladimir putin said european capital going path trampling democratic norm said russia want interfere france internal affair elon musk also weighed french court decision posting x radical left cant win via democratic vote abuse legal system jail opponent others welcomed verdict marine tondelier head france green party said le pen must serve sentence subject law like everyone else olivier faure france socialist party echoed tondeliers comment post x writing one law even marine le pen defended lifelong ineligibility elected official embezzle public fund marine le pen silenced continue member parliament sponsor message become npr sponsor,,unknown,"['Paris', 'Paris', 'France', 'France', 'the United States', 'Washington', 'Brazil', 'Paris', 'Russia', 'France', 'France', 'France']",https://www.npr.org/2025/03/31/g-s1-57262/france-marine-le-pen-embezzlement-verdict,2025-03-31T09:30:17Z
microsoft working making easier talk pc window support voice command like open edge largely accessibility purpose latest insider preview build taking step toward going full star trek instead remembering set phrase microsoft want enable user give command natural language mean open edge browser intuitive phrase express intent open edge could say open edge open edge please switch edge app along variation window happens get confused show realtime command suggestion based think want direct successfully interacting computer natural voice command something see scifi time current tech getting better better working natural language definitely way making reality example imagine window natural language voice command combined new aipowered search feature combo would allow user ask computer open monthly expense spreadsheet last week without remember exact file name put throw image facial recognition could ask find photo shibuya crossing show picture dog accuracy everything kind feature probably take time effort get right definitely exciting prospect actual new feature future application im getting excited available right snapdragonpowered copilot pc microsoft hasnt mentioned anything support intel amd processor yet surely come eventually since test feature window insider preview build there saying get general release hopefully window insider blog post microsoft announced ai upgrade window search make finding photo document setting easier however enhanced feature restricted copilot pc snapdragon processor amd intel support coming soon update fix improvement build nonetheless best copilot pc left simply use amd intel processor microsoft release update gradually also take advantage semantic lexical indexing search photo document efficiently improvement dont remember exact file name youre looking huge timesaver microsoft appears working new major update youre hoping window wouldnt hold breath company confirmed testing new content via insider program dev channel change might lead patch thats set released later year however likely looking successor current h build namely window h whole new operating system first spotted window central publication cite source claim microsoft backporting platform change offer better support qualcomms upcoming snapdragon x chip change allow device house chip run germaniumbased window germanium refers platform release current window build built look like upcoming h build might also based germanium nothing fully clear point snapdragonpowered window pc around almost year theyve missing one key app google drive beta arm version released last year became generally available yesterday app work exactly way google drive apps allowing user store file access device lack arm support apps like google drive one biggest barrier window arm result various inconvenience user tend drive away rather hardware likely softwarebased problem like trigger high return rate snapdragonpowered window pc please enable javascript view content upgrade lifestyledigital trend help reader keep tab fastpaced world tech latest news fun product review insightful editorial oneofakind sneak peek,,high,"['AI', 'Shibuya Crossing', 'Windows Insider', 'AI', 'Windows Central', 'Arm64', 'Arm64']",https://www.digitaltrends.com/computing/windows-voice-commands-are-getting-more-natural/,2025-03-18T14:08:46Z
samsungs official store here trick save new galaxy ultra article part gizmodo deal produced separately editorial team may earn commission buy link site havent yet upgraded smartphone game switching galaxy ultra samsung insisting making difficult possible resist temptation latest eyepopping incentive get make big switch samsungs brandnew flagship phone instant tradein offer instant credit would bring price galaxy ultra gb see samsungcom even skip tradein offer samsung give galaxy ultra get experience industryleading feature great financing installment offer samsung breadcrumb meant lead maybe best android smartphone market cellphone cellphone loaded incredible feature go well beyond calling texting like samsung galaxy ultras photo video feature mp ultra wide lens take incredibly vivid detailed still video image galaxy ai take care sensing lighting making necessary correction skin tone texture fine detail youre edit photo galaxy ai also power ultras video capability night video audio eraser technology let shoot crisp cleat video even there barely natural light without harsh background noise distract viewer play back video photo youll really appreciate inch screen galaxy ultra samsungs sharpest brightest smartphone display yet four beautiful color galaxy ultra find store titanium black titanium gray titanium whitesilver titanium silverblue joined three onlineexclusive color titanium jadegreen titanium jetblack titanium pinkgold selling like crazy availability may issue regardless color ultra steal max tradein offer also chance max dive samsung galaxy ecosystem samsung also offering galaxy bud pro galaxy ring galaxy watch ultra galaxy watch needed reason head samsung take advantage incredible incentive powerful versatile smartphone yet galaxy ultra see samsungcom get best tech science culture news inbox daily news future delivered present please select desired newsletter submit email upgrade inbox may earn commission buy link site gizmodo usa llc right reserved mode follow u mode follow u,,low,[],https://gizmodo.com/on-samsungs-official-store-heres-the-trick-to-save-70-on-the-new-galaxy-s25-ultra-2000577206,2025-03-18T11:10:05Z
