text,disaster_type,severity,locations,url,published_at
doge cut arrived federal weather agency air travel forecast hurricane alert risk california recovers devastating wildfire hurricane season fast approach president donald trump white house doge team slashing workforce federal agency responsible monitoring extreme weather business insider spoke dozen current former employee national oceanic atmospheric administration said staff policy change making daytoday job challenging worried upheaval would affect american safety especially hurricane tornado season rapidly approach andrew hazelton former noaa hurricane modeler fired february alongside probationary employee blunt forecast hurricane warning go downhill told bi could see loss life result agency reach extends across country globe besides work extreme climate condition noaa provides data power weather app phone alert pilot turbulence help farmer know plant keep american agriculture rolling really truly affect every single american every day former probationary employee said employee spoke asked remain anonymous trump took office january noaa employed around people according congressional report employee departed layoff buyout said joann becker president national weather service employee organization union representing noaa employee terminated february took administration buyout offer according previous reporting uncertain future probationary employee voluntary early retirement buyout trump ongoing governmentwide reductioninforce effort agency may shrink would like go job save people life employee national weather service department within noaa said outside staffing cut employee said stricter rule around travel expense budget made difficult job vital protecting people natural disaster expiration date contract marked urgent also coming soon according internal document viewed bi extensive process conducted ensure missioncritical function fulfill noaa statutory responsibility werent compromised trump administration spokesperson told bi statement spokesperson declined provide additional detail process susan buchanan noaa spokeswoman said agency remains dedicated mission spokesperson department commerce oversees noaa respond request comment bi remain show must go even resource staff dwindle catching lot ball little people noaa employee said eventually one probably going fall several people spoke bi expressed unease staffing cut operational change noaa could affect aviation industry though flying remains safest mode transportation national weather service employee who worked agency decade said turmoil agency continues long term dont know id trust getting plane noaa assist running aviationspecific weather model pilot helping track thing like turbulence data ripple right whole system brad colman former president american meteorological society said system degraded turbulence forecast may go quality uncertainty increased colman said there exposure risk spokesperson airline dispatcher federation told bi email noaa provides dispatcher essential tool including turbulence wind weather forecast virtually weather data domestic flight come noaa data fundamental daily operation spokesperson said organization hasnt yet noticed operational impact warned even subtle degradation could affect operation federal aviation administration respond request comment meteorologist work airline receive foundational data noaa develop forecast spokesperson added noting smaller airline likely face challenge noaa data degrades potentially creating disparity safety across industry tom di liberto former public affair official climate scientist fired february put there reason lot weather forecast office close major airport staffer affected termination werent noaa headquarters maryland stationed regional office across country one office alaska stopped launching daily weather balloon collect data forecast larry hubble upper air program manager state said march national weather service temporarily suspended weather balloon launch office nebraska south dakota seven site scaling back one launch day instead two staffing shortage instrument like radar commercial aircraft satellite also collect data nw employee decade said balloon one accurate method weather measurement theyre scaled back theyre going start seeing degradation model forecast going lose accuracy degrade capability warning get weaker people property get compromised noaa employee told bi damage going increase people going get harm way theyre going die government accountability office said march report staffing shortage aircraft maintenance problem recent year already hampered hurricane hunter ability perform job well doge ever came knocking door change noaa likely ripple across private sector affecting range industry employee told bi reinsurance industry example us noaa data help confirm damage natural disaster dole fund construction worker rely noaa data figure build new project economic implication vast noaa product impact onethird country gdp according agency website take noaa private sector noaa di liberto said agency operates thousand weather balloon hundred buoy airplane satellite make information accessible entire public pay spokesperson airline dispatcher federation said private weather company provide helpful supplemental service ultimately rely noaa raw data simply replacement noaa comprehensive data collection infrastructure spokesperson said additional reporting juliana kaplan tip contact reporter via email signal atecotzkybusinessinsidercom alicetecotzky cboudreaubusinessinsidercom cboudreau neinbinderinsidercom neinbinder use personal email address nonwork device here guide sharing information securely jump,hurricane,high,"['California', 'BI', 'Maryland', 'Alaska', 'Nebraska', 'South Dakota']",https://www.businessinsider.com/doge-noaa-cuts-air-travel-extreme-weather-hurricane-tornado-2025-3,2025-03-27T18:49:22Z
junta carry fresh air strike rebel devastation myanmar military junta continued bomb part wartorn country following major earthquake killed people un described attack completely outrageous unacceptable special rapporteur tom andrew told bbc nothing short incredible military continuing drop bomb trying rescue people earthquake called military regime seized power coup nearly four year ago stop military operation anyone influence military need step pressure make clear acceptable said im calling upon junta stop stop military operation added bbc burmese confirmed seven people killed air strike naungcho northern state strike took place around local time less three hour quake struck prodemocracy rebel group fighting remove military power reported aerial bombing changu township northwestern sagaing region epicentre quake also report airstrikes region near thai border national unity government nug represents ousted civilian administration said statement armed force would begin twoweek pause offensive military operation except defensive action area affected earthquake sunday magnitude earthquake struck sagaing also felt neighbouring country followed report destruction coming nearby mandalay myanmar second largest city well capital nay pyi taw mile km away junta say people known died many believed trapped rubble quake come four year civil war myanmar followed military coup coup triggered huge protest thousand taking street daily demanding restoration civilian rule initially began civil disobedience campaign soon evolved widespread insurgency involving prodemocracy ethnic rebel group eventually sparked allout civil war four year violent fighting continued military one hand ethnic army armed resistance group junta suffered continual humiliating defeat lost vast swathe territory increasingly relying air attack crush resistance rule large part sagaing region epicentre earthquake control prodemocracy resistance group bbc investigation revealed nearly four year seizing power coup military control less quarter country investigation revealed ethnic army patchwork resistance group control country land mass much remaining area remains contested aerial combat military regime upper hand resistance group lack capacity fight back air military history carrying indiscriminate aerial bombardment destroyed school monastery church hospital one deadliest airstrikes people killed including many woman child un body investigating human right violation country warned military junta committing war crime crime humanity people military aerial warfare sustained continued support russia china despite un call arm embargo response coup china russia sold junta sophisticated attack jet provided training use russia china also sent aid rescue team myanmar ukbased burmese right activist julie khine said hard trust sympathy theyre also country supplying military junta deadly weapon used kill innocent civilian also widespread concern military use aid weapon civil war myanmar military longstanding practice denying aid area resistance group active un tom andrew told bbc past relief effort military blocked aid arrested aid worker know past humanitarian disaster natural disaster junta reveal truth also habit blocking humanitarian aid getting needed said weaponise aid send area control deny area area acute need exist literally aid trying get truck blocking way people arrested pattern response natural disaster past im afraid im fully expecting case disaster mount marapi erupted thursday sending column ash towering sky donald trump sweeping tariff shaken global trade india turn disruption opportunity bbcs yogita limaye first foreign journalist enter country since disaster struck say truce effect april speed relief effort last week deadly earthquake cornishbased charity say received generous donation part appeal copyright bbc right reserved bbc responsible content external site read approach external linking,earthquake,high,"['Myanmar', 'Naungcho', 'Chang-U', 'Sagaing', 'Myanmar', 'Sagaing', 'Russia', 'China', 'China', 'Russia', 'Russia', 'China', 'Myanmar', 'UK', 'Myanmar', 'India']",https://www.bbc.com/news/articles/cy7x7r8m3xlo,2025-03-29T17:04:50Z
california boomer moved hallmark town arizona saving month bill living moorpark california nearly two decade brenda duncan cusick become expert wildfire evacuation cusick told business insider shes flee home shared husband two child least five time moorpark hour drive northwest los angeles close deadly woolsey fire destroyed thousand home time saw blaze becoming difficult control wildfire also affected cusicks career insurance agent sold homeowner commercial auto policy including farmer insurance became harder keep attract client rate tripled case due combination factor including fire risk rising cost reinsurance california regulation cusick said lost lot sale people wanted save insurance would advise carry coverage cusick said theyd million home small business id tell could lose everything theyve worked underinsured cusick said rising wildfire risk combined higher insurance premium utility bill gas price car registration fee family four made realize impossible retire california shes alone hundred thousand californian moved state recent year often driven high price case natural disaster risk resident among highest average energy bill country part utility company spent billion dollar wildfirerelated cost partially passed customer california also aggressive climate policy make oil gas expensive covid pandemic gave cusick husband freedom work remotely decided sell home move prescott arizona joined many older american flocked arizona retirement citing lower cost living comfortable weather little data indicating climatefueled disaster directly causing massive migration cusicks story suggests costly ripple effect wildfire insurance utility bill may help motivate people leave longtime home cusick said first daunting consider leaving home state realized many lovely place live u said adding monthly expense dropped couple thousand dollar downsized bedroom bathroom home moorpark bedroom bathroom property prescott cusick said selling california home gave enough cash large payment new place arizona monthly mortgage payment compared california according bank statement reviewed business insider utility hoa bill arizona average month california could range cusick said prescott reminds growing california western town mountain arizona said noting prescott surrounded national forest prescott capital arizona territory late every fourth july host big rodeo downtown reminds cusick hallmark move said prescott history cooler summer temperature location phoenix grand canyon help attract thousand tourist every year cusick retired insurance industry got involved local charity started prescott food tour completely opposite selling boring impossible insurance said mean make anywhere near youre retired get thing like story share leaving area prone wildfire rising home insurance cost contact reporter cboudreaubusinessinsidercom jump,wildfire,high,"['California', 'Arizona', 'Moorpark', 'California', 'Los Angeles', 'California', 'California', 'California', 'Prescott', 'Arizona', 'Arizona', 'US', 'Moorpark', 'Prescott', 'California', 'Arizona', 'California', 'Arizona', 'California', 'California', 'Arizona', 'Arizona', 'Phoenix', 'the Grand Canyon']",https://www.businessinsider.com/leaving-california-boomer-moved-arizona-wildfires-rising-costs-retirement-savings-2025-3,2025-03-08T09:04:02Z
apple donating myanmar thailand earthquake relief effort apple ceo tim cook today said apple donating undisclosed amount towards earthquake relief effort myanmar thailand heart go myanmar thailand affected devastating earthquake said cook social medium post apple typically donates red cross following major natural disaster around world note due political social nature discussion regarding topic discussion thread located political news forum forum member site visitor welcome read follow thread posting limited forum member least post get weekly top macrumors story inbox new visual intelligence feature iphone model tweak notification summary apple intelligence apple calling artificial intelligence feature set previewed wwdc june here everything know image playground apple dedicated image creation app build cartoonlike picture based text description youre experiencing issue iphone mirroring follow step get working apple annual developer conference unveil io macos biggest design overhaul since io new apple intelligence feature new mgeneration chip additional upgrade apple nextgeneration iphone model new air slim model replacing current plus model day ago joe rossignol day ago joe rossignol day ago tim hardwick day ago joe rossignol day ago joe rossignol macrumors attracts broad audience consumer professional interested latest technology product also boast active community focused purchasing decision technical aspect iphone ipad mac apple platform,earthquake,high,"['Myanmar', 'Myanmar', 'Thailand', 'Myanmar', 'Thailand', 'New M4']",https://www.macrumors.com/2025/03/30/apple-donating-myanmar-thailand-earthquake-relief/,2025-03-30T17:22:00Z
atomfall forgotten nuclear disaster inspired video game fukushima three mile island chernobyl place forever remembered site nuclear disaster people heard fewer aware windscale fire one world first remains uk worst nuclear accident nuclear reactor site cumbria caught fire october burned three day releasing radioactive material atmosphere many detail event kept quiet decade far less famous recent example new video game brought disaster area happened back spotlight atomfall latest release oxfordbased rebellion best known longrunning sniper elite series ceo jason kingsley tell bbc newsbeat walking lake district idea using reallife windscale story trigger point fictionalised version disaster began take shape atomfall survival action game set rolling green landscape beauty spot alternative scifi inspired timeline area surrounding plant become quarantine zone went pretty wrong real life controlled say jason proper disaster didnt cause strange glowing plant mutant dangerous cult emerge although windscale fire serious jason say something especially wellremembered even among local previously estimated case cancer caused radioactive leak recent research suggested link unlikely scientist suggested decision destroy milk produced within square mile square km site month fire helped prevent exposure windscale eventually renamed sellafield produced nuclear power still employ people local area newsbeat visit cumbria young people speak say havent heard disaster indie game developer hannah robert harry howson say became aware game announced two people like hope break game industry theyre excited see game set place live hannah say evident atomfalls maker done research actual environment spot theyve got fantastic morris dancing stuff going really tickled saw say hannah say small detail like black white cumbrian signpost also pleasing see atomfalls setting inspiration made anticipated title since first revealed last year harry say thats encouraging seeing small space like cumbria taken game industry built upon people receptive exciting future look forward seeing whats next say fairly unusual highprofile game set uk set outside london indie game shropshireset everybodys gone rapture last year barnsleybased laughfest thank goodness youre ventured north bigger game havent tended stray beyond jason say u video game market important appeal player there natural tendency follow norm independent company feel allows rebellion thing differently britain offer lot inspiration new setting youre prepared look uk think understand certain aspect culture youve got dig little bit tend understate thing quite lot rebellion head design ben fisher say goal create slightly theme parkish version lake district accurate detail thing local easy u forget unique britain unusual say team worked game member various country ben say helped highlight thing uk native might missed lead artist project seattle mystified dry stone wall say ben add team spent time recreating structure constructed without use mortar capture local detail featuring local area film tv show expose new audience place ultimately whats incredibly rewarding industry put idea played people across globe jason say know wonderful sort talk lake district people live africa southeast asia canada wherever might thats kind form soft power type medium oliver hodgson see sellafield bedroom window hope local area benefit soft power jason describes think incredibly powerful thing young people west cumbria say think really positive see big gaming developer set story cumbria normally known lake mountain say oliver run pr firm working creator project create gaming hub whitehaven aimed boosting digital skill area oliver say he glad game taken inspiration windscale drawing attention area well switching local history think say story windscale disaster obviously isnt positive one cant rewrite history acknowledging happened teaching letting young people learn history brings classroom young people phone social medium listen newsbeat live weekday listen back new film maria explores life maria schneider mistreatment one notorious explicit scene cinema history venue kendal say every effort made try sell business going concern heritage group hope money help save building threat demolition sellafield say disappointed figure step taken tackle gap cloister appeared numerous film tv show including harry potter wolf hall copyright bbc right reserved bbc responsible content external site read approach external linking,wildfire,low,"['Chernobyl', 'UK', 'Cumbria', 'Oxford', 'the Lake District', 'UK', 'London', 'Shropshire', 'US', 'Britain', 'UK', 'the Lake District', 'Britain', 'UK', 'Seattle', 'the Lake District', 'Africa', 'Southeast Asia', 'Canada', 'west Cumbria', 'Cumbria', 'Whitehaven', 'Newsbeat', 'Kendal']",https://www.bbc.com/news/articles/c5y4n5127dxo,2025-03-27T00:04:56Z
aigenerated review summary coming apple app store feature arrive io feature arrive io jennifer pattison tuohy apple bringing aigenerated review summary app store io spotted macworld latest developer beta io ipados add brief summary user review app store listing summary generated large language model compile highlight key information user review short paragraph according detail apple developer site based apple example summary use natural language highlight user say app starting positive feedback finishing negative feedback apple say summary refreshed least week new review added user able tap hold review report problem feature summary initially available u app store apps game published english enough review generate summary available country language later year apple move follows amazon addition aigenerated review highlight ecommerce site short paragraph highlight product feature customer sentiment frequently mentioned across written review appear full review theory review summary helpful saving reading bunch review get highlight also feel potentially ripe gaming likely encourage unscrupulous company flood review section experience amazon summary find focus positive aspect first feel disingenuous review product living something bad absolutely first thing say weekly newsletter david pierce designed tell everything need download watch read listen explore fit verge universe vox medium llc right reserved,flood,low,"['AI', 'US', 'AI']",https://www.theverge.com/news/624891/ai-generated-review-summaries-coming-to-apples-app-store,2025-03-05T22:23:29Z
help victim myanmar earthquake reporter devastating earthquake central myanmar medical worker seen next medical material placed compound hospital country capital naypyidaw march reporter relief effort continue southeast asia devastating earthquake shook myanmar neighbor friday march per update shared myanmar authority saturday death toll risen addition authority report people injured others missing mandalay myanmar second largest city among hardesthit area widespread destruction meanwhile thailand total people reported killed earthquake far site collapse highrise building construction dozen people said unaccounted advertisement advertisement sunday march magnitude aftershock struck near mandalay prompting alarm rescue effort continued read photo show devastating impact powerful earthquake rocked myanmar thailand myanmar ruling military junta declared state emergency several region affected earthquake friday called humanitarian aid rare show international appeal amnesty international myanmar researcher joe freeman said statement earthquake could come worse time myanmar still reel military coup subsequent displacement mass civil war party armed conflict prioritizing need civilian whose life upended disaster ensuring unfettered access aid freeman said human right must centre relief effort must discrimination aid provision unicef originally united nation international childrens emergency fund also addressed myanmar precarious situation statement unicef usa website called party uphold right child ensure unhindered humanitarian access affected area continue recovera process beguncountries around globe come send humanitarian aid way help victim myanmar earthquake united nation calling donation addition initial allocation million un emergency fund emergency relief coordinator tom fletcher donation go directly myanmar humanitarian fund provide urgently needed food water shelter basic support critical time red cross red crescent working deliver emergency relief get help impacted earthquake quickly possible team myanmar red cross society also working connect hospital clinic emergency blood donation unicef run disaster relief operation focused childrens need asked donation specifically child impacted displaced earthquake unicef ground myanmar working partner meet childrens need earthquake latest blow country already struggling escalating conflict climate shock agency website read save child international nongovernmental organization ngo work specifically protect child risk launched childrens emergency fund youth myanmar need shelter basic need aftermath disaster project hope working address urgent longterm need including primary mental health shelter water sanitation hygiene affected earthquake nonprofit organization previously responded natural disaster deploying humanitarian aid place morocco syria turkey haiti time usa llc right reserved use site constitutes acceptance term service privacy policy privacy right sell share personal information time may receive compensation link product service website offer may subject change without notice,earthquake,high,"['Myanmar', 'Southeast Asia', 'Myanmar', 'Myanmar', 'Myanmar', 'Thailand', 'Myanmar', 'Thailand', 'Myanmar', 'Myanmar', 'Myanmar', 'Myanmar', 'Myanmar', 'Myanmar', 'Myanmar', 'Morocco', 'Syria', 'Turkey', 'Haiti']",https://time.com/7272824/how-to-help-victims-of-myanmar-earthquake-thailand-relief-efforts/,2025-03-29T17:37:18Z
